HEADER,QUEST,ORDER,PERSON,TEXT,EMOTION,RESPONSES,,,items,,,TEXT SZE,,SUMMARY,
,,,,"Now that everything is <font color=""ffffff"" oline=""2"" olcolor=""92633a"">beautiful and ready</font> I shall have some rest and you go get into a <font color=""ffffff"" oline=""2"" olcolor=""92633a"">proper outfit</font>! ",:),I will,,,,,,,,,213
,,,,,:(,Oh...,,,,,,,,,0
,,,,,,,,,,,,,,,
,Chef-9,before,chef,"Oh, no-no-no-no! This is <font color=""ffffff"" oline=""2"" olcolor=""92633a"">all wrong</font>! How could this happen! ",:),What's wrong?,,,,spices,cooking kit,coffee,,That's a disaster! This kitchen is cursed,114
,,,,,:(,Something happened,,,,,,,,,0
,,,chef,"My <font color=""ffffff"" oline=""2"" olcolor=""92633a"">main course</font>! My masterpiece! It's <font color=""ffffff"" oline=""2"" olcolor=""92633a"">ruined</font>. All the spices are wrong. And that broth, why is it all black and shiny!?",:),"Shiny's good, right?",,,,,,,,,228
,,,,,:'(,How could that happen!?,,,,,,,,,0
,,,chef,"The spices <font color=""ffffff"" oline=""2"" olcolor=""92633a"">were right</font>! And the broth was right! It feels like some <font color=""ffffff"" oline=""2"" olcolor=""92633a"">evil spell</font>. And we don't have time to make a <font color=""ffffff"" oline=""2"" olcolor=""92633a"">new dish</font>!",:),What shall we do now?,,,,,,,,,286
,,,,,:'(,Oh no!,,,,,,,,,0
,,,chef,"Still we have to make <font color=""ffffff"" oline=""2"" olcolor=""92633a"">something else</font>. And quickly. Go, bring me some <font color=""ffffff"" oline=""2"" olcolor=""92633a"">pots and pans</font> and more <font color=""ffffff"" oline=""2"" olcolor=""92633a"">spices</font>. And also some <font color=""ffffff"" oline=""2"" olcolor=""92633a"">coffee</font>, it helps me work",^^,I'll have 'em in no time,,,,,,,,,358
,,,,,:/,Super*name* will save the day. And the broth.,,,,,,,,,0
,,,,,,,,,,,,,,,
,,after,chef,"Good, good. Thank you. Now <font color=""ffffff"" oline=""2"" olcolor=""92633a"">let me work</font>.  ",^^,Good luck!,,,,,,,,,96
,,,,,:(,How rude...,,,,,,,,,0
,,,,"And please come up with <font color=""ffffff"" oline=""2"" olcolor=""92633a"">some way</font> to keep the guests <font color=""ffffff"" oline=""2"" olcolor=""92633a"">entertained</font> while I'm working. The preparations will take at least an hour. ",^^,I'll come up with something!,,,,,,,,,238
,,,,,:/,I'll dance them a merry jig,,,,,,,,,0
,,,,,,,,,,,,,,,
,Manager-9,before,manager,"This is a <font color=""ffffff"" oline=""2"" olcolor=""92633a"">disaster</font>! Everything is <font color=""ffffff"" oline=""2"" olcolor=""92633a"">ruined</font>! Our reputation is ruined. I knew something was going to <font color=""ffffff"" oline=""2"" olcolor=""92633a"">go wrong</font>, I felt it. ",^^,We can still fix it,,,,french bread,pastry stand,,,"Desperate times call for desperate measures! The bakery is great, though",284
,,,,,:'(,"It's awful, I know",,,,,,,,,0
,,,manager,"You're right, we have to <font color=""ffffff"" oline=""2"" olcolor=""92633a"">pull ourselves together</font> and fix things. I hate quick fixes, but desperate times call for desperate measures. ",:),What do you have in mind?,,,,,,,,,189
,,,,,:(,Measures I'll have to take,,,,,,,,,0
,,,manager,"Yes. There is a great <font color=""ffffff"" oline=""2"" olcolor=""92633a"">bakery</font> not far from here. Go there and get <font color=""ffffff"" oline=""2"" olcolor=""92633a"">some croissants</font> for our guests. And also get a nice <font color=""ffffff"" oline=""2"" olcolor=""92633a"">porcelain stand</font> to serve them.",:D,Got it!,,,,,,,,,312
,,,,,:(,If you think it'll work,,,,,,,,,0
,,,,,,,,,,,,,,,
,,after,manager,"This looks <font color=""ffffff"" oline=""2"" olcolor=""92633a"">promising</font>. That bakery's pastry is incredible, I hope our guests enjoy it until the main course is ready. ",^^,I'm sure they won't notice anything,,,,,,,,,172
,,,,,:'(,Hope is all we have,,,,,,,,,0
,,,manager,"Thank you for your help with this <font color=""ffffff"" oline=""2"" olcolor=""92633a"">madness</font>. Now that everything is more or less in order, I have time to <font color=""ffffff"" oline=""2"" olcolor=""92633a"">thank you</font> for all you help. ",:D,I'm happy to be useful,,,,,,,,,242
,,,,,:(,Don't forget my recommendation,,,,,,,,,0
,,,,,,,,,,,,,,,
,SousChef-9,before,souschef,"What an <font color=""ffffff"" oline=""2"" olcolor=""92633a"">unfortunate</font> turn of events with the main dish, don't you think? I am glad <font color=""ffffff"" oline=""2"" olcolor=""92633a"">my part</font> was all done perfectly",:),That's a relief indeed,,,,tailcoat,flowers,gift card,,"I am in a hurry, so hurry up!",222
,,,,,:(,That's suspicious,,,,,,,,,0
,,,souschef,"I will <font color=""ffffff"" oline=""2"" olcolor=""92633a"">never screw up</font> like Enzo did. But I don't have time to think about this now, I have <font color=""ffffff"" oline=""2"" olcolor=""92633a"">my own plans</font> for the evening",:),What plans?,,,,,,,,,229
,,,,,:(,Really? Now?,,,,,,,,,0
,,,souschef,"My plans are private, but you must still <font color=""ffffff"" oline=""2"" olcolor=""92633a"">help me prepare</font>. I need three simple things: a <font color=""ffffff"" oline=""2"" olcolor=""92633a"">tailcoat</font>, a <font color=""ffffff"" oline=""2"" olcolor=""92633a"">bouquet</font> and a <font color=""ffffff"" oline=""2"" olcolor=""92633a"">card</font>. Go get them!",:D,You have a date!,,,,,,,,,352
,,,,,:(,You have a date!?,,,,,,,,,0
,,,,,,,,,,,,,,,
,,after,souschef,"You brought everything I asked for? <br/><font color=""ffffff"" oline=""2"" olcolor=""92633a"">Good</font>. Since you helped me on so many occasions, I'll <font color=""ffffff"" oline=""2"" olcolor=""92633a"">approve</font> giving you the recommendation",:),Really? Thank you,,,,,,,,,236
,,,,,:/,Why does it feel like you're doing me a favor?,,,,,,,,,0